;text;target
271;smieszny koles opinie o on byc niezbyt pozytywny jednak ja sie specjalnie do on zapisac em bo doktor caly zajecie rozwiazywac zadanek radze o nic sie nie pytac bo potrafic na pytanie czy miec przemyc probowke woda destylowac potrafic odpowiedziec teoria o lepkosc i zmiana ph i na przyklad rachunkie prawdopodobiensta dobrze przejsc sie juz na drugi laboratorium i spytac sie inny prowadzacy i zaoszczedzic z minuta ale jesli chodzic o podnoszec ocena to nie miec szansa doktor kowal naleza do osoba ktory trzymac sie regulamin studia jak skoczek spadochron wiec dobrze sie nauczyc a z on nie dyskutowac ps jesli za duzo nie umiecie a chcec to zdac to nie polecac a jesli prowadzic miec wy nie przeszkadzac na cwiczenia i sam potraficie nauczyc to jak bardzo byc kool;3
272;opinie na podstawa kursui fotogrametria na wydzial is sposob prowadzic zajecie chaotyczny czy potrafic nauczyc niebardzo podstawa ocena w indeks zaliczec kolokwiac niespodziewajka brak poczucie humoruz ogolny podejscie do student nieprzyjazny wykladowca z akademia rolniczy dlatego chyba niebardzo on zalezec na tresc wyklad wyklad prowadzic w forma tematyczny opowiesc stad czesto profesor powtarzac sie z zagadnienie sposob wypowiedz chaotyczny ciezko cokolwiek zanotowac na kolokwia stosunkowo malo czas;1
273;algebry z ga bardzo dobry na wyklada pisac na tablica w tempo tornado ledwo co mozna nadazyc ale zawsze byc smieszc z wzglad na historyjka opowiadac przez pani doktor a to o ruski ksiazka do matematyka ktory kupowac na rynek za kopiejka a to o student ktory zaliczac algebre raz i miec zielony irokez a to ze puszka piwo bezalkoholowy oczywiscie mrgreen musiec byc taki ksztalt jak obecnie bo to zloto linia i tym podobne d tlumaczyc klarownie jak ktos cos nie rozumiec powtorz pozwalac poprawic jeden z kolokwiow zazwyczaj to ktory zle poszlo student po termin egzamin dopytac w raz niepowodzenie tam gdzies podciagnie ocenka tam doda punkt ogolnie oki przyjazna dla student miec ogromny zasob wiedza ktory chciec przekazac ale widac ze za dlugo siedziec w ten matma wink zreszta jak my powiedziec na pierwszy wykladzie ze algebra to on drugi milosc czy cos podobny ogolnie polecac;2
274;dotyczyc laborka z elementow programowanie pan doktor byc chemikio jednak prowadzic ten kurs na nasz wydzial wszystko byc mozliwy d ale do rzecz zajecie przyjemny bezstresowy obecnosc obowiazkowy byc piec kartkowka wejsciowka ktore SA podstawa zaliczenie za kazda mozny dostac jeden punkt aby zaliczyc przedmiot trzeba miec punkt rzecz jasny mrgreen zakres material obowiazujak na kartkowk byc naprawde banalny dotyczyc tylko i wylaczc to co bylo na ostatni zajeci;2
275;profesor j grzechowiak kurs marketing i wyklad ocen byc okolo b mozna sie duzo nauczyc premiowac byc obecnosc na wyklad pani profesor byc bardzo sympatyczny ale niugac ten cecha niech kazdy ocic wedlug siebie ja to nie przeszadzac zaliczyc kurs na bez wielki wysilek ogolnie polecac;2
276;kurs pan wilczynski byc bardzo mily dla student wyklad bardzo fajnie prowadzic kolo pierwszy kolo latwy jak cos za malo punkt miec to idza na konsultacja zawsze ty dozucic punkt ja to akurat uratowac pan do zdobyc x punkt drogi kolo latwiejsz doktor che zeby jak najwiecej czlowiek zaliczyc czytac gazete a czas tylko patrzyc co czlowiek robic gdzie wszyscy sciagac d x punkt x punkt dodatkowy;2
277;analiza wyklad przepisowac swoj skrypt na tablica wiec nie oplacac sie chodzic jesli miec dosc samozapracie by to przeczytac w dom ogolnie odradzac;1
278;komunikacja i ekspresja ocena moc byc choc nudno b nudny zajecie ale za punkt zaliczec przez dwa kolo choc mozny korzystac z notatka nawet nie swoj pan obecnosc lista byc na ktory mozny wpisywac znajomy ogolc polecac;3
279;doktor popko nie stresowac niepotrzebnie student chociaz jednostk bardzo leniwy potrafic zepsuc humor przed cwiczenie pytac wystarczyc ogolny znajomosc problem sprawozdanie sprawdzac dosc dokladnie jesli miec czas sporo zwracac konkretny niewygorowany wymaganie i mily atmosfera na zajecia sprawiac ze zdecydowanie polecac;2
280;lab bez niespodzianka poza normalny program dwa program zaliczeniowy pisac przy wylaczyc necie nie trzeba oddawac wszyscy do ocena koncowy liczyc sie sredni z wszyscy przy co nieoddac to spokojny neutralny atmosfera raczej nie miec na co narzekac choc i bez rewelacja;3
281;kurs laboratorium h i h polecac super pani b pani trzmiel byc bardzo mily ladny i fajny robic jeden zapowiedziac wejsciowke bodajze na trzeci laboratorium nie robic problem z sprawozdania oczywiscie oddac ale tylko raz d;2
282;wyklad co tydzien nudny pokaz slajdow sruba gwint balbalbal poprost isc zasnac labork istny rzez potrafic sie przyczepic do wszystek stwarzac problem z zaliczanie poszczegolny zajec trzeba sie naprawde niezle napracowac w porownanie do inny prowadzacy przyklad weglinska dac a za ten sam inny wazna byc obecnosc ktora sprawdzac bo na drugi kolo jesli bedzieshc pisal takowy mozesh bedziesh mial latwiejsza grupe potrafic nauczyc ale nie potrafic zaliczyc podstawa zaliczec laborek byc zaliczec wszystek zajec na laborka co tydzienc jakies zaliczec kilka rysunkowa reczny ktore robic sie w dom i oddawac w wyznaczyc termin u profesor weglinski jak juz wspominal ciezko zaliczac cada a jezel chodzic o rysunek reczny to przyczepiac sie do wszystko i kazda poprawiac srednio raz bo mar po on dlugopis i trzeba robic od nowy twisted jezec chodzic o zaliczec wyklad to pierwszy kolokwium na ktory rysowac sie rysunek na lepsz ocene z co ten pierwszy trzeba miec calkowita dobrze zeby miec przynajmniej potrafic przyczepic sie do wszystek os symetri za grubym olowkie rysowac wkrecajac sruby w drewniany otwor z gwint naleza narysowac wybrzuszic drewno po drugi strona w ksiazka nic o to nie miec i wlasc na ten podstawa cie oblej jezel nie zaliczyc na pierwszy kolo to na drugi twoj szansa spadaj praktycznie do zero zaliczac on kilka osob miec jeszcze szansa na kolokwium ktore byc system pucharowy rysunkowa rysowac sie on sprawdzac kto miec dobrze zostawac kto zle wychodzic i Rund zalicz system srednio osoba gdyz pytanai SA typ podac przyklad tolerancja bic osiowy i nikt nie wiedziec o co chodzic drobniejy szczegoly d nic z ten rzecz zerowy calkowica nieprzyjazny ten czlowiek chyba siebie musiec napluc w twarz jesli nie oblej przynajmniej polowy studentow twisted zdecydowanie odradzac;1
283;fizykac i wyklad i cwieczec b na cwiczenie chodzil regularnie fzyka nie umiec ale uczyl sie przed zajeci zadan z skrypt na pamiec ten co byly na lista do zrobic kilka raz sie zglosil do tablica milo ja zapamietalac i zaliczyl praktycznie na ladny oko takzeyc ejst zadomowlyc sprawiedliwy pani doktor byc sredio jak ktos do gust przypadl jak ja to mial looz ale jak ktos podpald to nawet nie bylo sesus uczyc bardzo on nie odpowiadajac wypic z;3
284;wykladowca o ogromny wiedza ktory potrafic przekazac swoj sluchacz z zaliczeen nie miec problem podwarunkie z sie do kolokwium przygotywac goraco polecac;2
285;pani doktor byc mily i sympatyczny starac sie pomoc student miec duzy wiedza i chetnie sie on dzielic na labork tylko do on mrgreen b;2
286;niby kurs b a material jaki sie przerabiac zawierac sie w b b e i zachaczac o b zaliczec na postawa test ktory chyba wogole nie czytac uwazac sie za wszechwiedzaca na temat angielski i nie lubic jak ktos miec inny zdanie pozno sie msc ogolnie nie polecac byc wiele inny prowadzic;1
287;pan byc nieziemski poprost ideal nie widziec nawet jak sie dziewczyna w pierwszy lawka z on smiej z lza na policzek bo patrzec sie tylko na panow i to do on kierowac swoj wypowiedz wole nie wnikac dlaczego bardzo wyskoko sie cenic poniewaz pol punkta kosztowac u on jedyny zloty konsultacja to dla on bardzo osobisty sprawa i nie zamierzac o to rozmawiac i nie powiedziec tez cio obowiazowac na kolokwiahc bo to malo istotny dla on d istotny byc ntomiast ograniczyc ciag i dziwic sie z wszystek wykladowca robic po dwa przyklad z ten temat przy co sam robic przyklad w ciagu h zajec do ten pan nie mozny przerywac bo to grozic za przeszkadzana w zajecie mimo iz odpowiadac sie na zadac przez on pytanie banalny zadanie robic sie godzina wiec dobrze nie wyobrazac siebie ile robic sie ten chociaz troszke trudniejsze aaa u on zaliczajac osoba na i jak to pan Marek okreslic;1
288;opinie na podstawa kurs plyn i na wydzial is sposob prowadzic zajecia zrozumiac czy potrafic nauczyc tak podstawa ocena w indeks zaliczec egzamin test pyt a b c niespodziewajka brak poczucie humoruz ogolny podejscie do student neutralny wyklad byc do skserowac i tylko to byc wymagac dobrze byc tez opracowac pytanie z poprzedni rok raz sprawdzac obecnosc w ciag semestr obecnosc dobry odpowiedz na egzamin jesli sie czlowiek pouczyc to zaliczyc bez problem;2
289;komunikacja i ekspresja ocena moc byc b zajecie byc strasznie nudny zaliczenie to kolo na ktory mozna a nawet nalezec korzystac z natatka badz nawet ksiazka ogolnie to na ten kolo byc kilka temat do wybor dokladnie taki jak byc na zajecia wystarczyc wiec miec z notatka w punkt i polac odpowiednio duzo woda i spokojnie mozna miec ogolnie latwy ocena ale ile sie wynudzic to twoj wink;3
290;cw z poczatek wydawac sie groznie zajecie prowadzic byc troszke chaotyczni jednak kolokwi bardzo prosty raczej isc na reka jak tylko sie dac aby kazdy moc zaliczyc jednak na cwiczenia zrealizowac smy tylko okolo material inny grupa pewnie dlatego nie chciec my slac na egzamin;3
291;wstep do filozofia religia i filozofi orient b jesli chciec odbebnic humac i nic sie nie nauczyc to byc cos dla ty doktor radzio mowic bardzo powoli mozna usnac czekac na nastepny zdanie jednakze obecnosc notowac byc na jeden tylko kartka ktory to krazyc po caly sala na kazdy zajecia i na ktory to kazdy wbijac siebie tlo obecnosc ile chciec choc czas doktor dlugopis zakreslac obszar dlgi nieobecnosc pod koniec kolokwium caly sala leciec na sciago pan doktor czas to akceptowac czas nie generalnie ocena pomiedzy a z ewentualny poprawieen nie miec zaden problem;3
292;algebry liniowa dla air na ekaa polecac do latwy kurs pani jako czlowiek dosc oschla dla student straszny balagan miec na tablica i trzeba sie porzadnie skupic i spieszyc zeby zdazyc z przepisywaen przy to robic zadanie ciagle sie mylic mimo wszystko jednak matriec wylozc przez pania zrozumiec metr bez problem moc dlatego ze algebra byc ogolnie prosty na kolokwium byc przewidywalny zadanie ten typ co na zajecia wystarczyc on zrozumiec i przejrzec skrypt czas zdarzac sie zadanie w ktory podstawowy problem byc karkolomny oblicznie bo dane zostac dobrac jakby na zlosc a pani w ocena zadanie zwracac uwaga niemalze tylko na wynik przy to nie miec nawet co marzyc o naciagnieciu jakis punkt z sprawdzony kolokwium choc by byc miec wszystko dobrze a zadanie dostac polowa punkt nie przekonac ten pani mozna miec wrazenie ze on ten kolokwium w ogol sam nie sprawdzac jak ty do zaliczec brakowac punkt to chocby byc blagac na kolano nie otrzymac zaliczenie jednak spokojnie mozna zaliczyc w kolokwi i nawet nietrudno byc zdobyc max punkt bo zadanie naprawde byc latwy ale nie polecac ten pani na przyklad do algebry kurs duzo trudniejszyc bo jednak w ten przypadek bac by metr sie ze on roztrzepac uniemozliwic ja zrozumienie wyklad;3
293;wyklad nudny w zasada wciaz powtarzac ten sam temat zaliczec bez problem kto pierwszy ten potem coraz nisko i trudno sciagac ref z net czytac doktor przerywac zadawac jeden pytanie do temat odpowiedziec nie odpowiedziec;3
294;wyklad prowadzic chaotyczc kwiatek na drzewa nigdy nie wiadomo o co chodzic co do cwiczenie nalezec byc zawsze przygotowany i warto zglaszac sie do tablica wtedy jak cos nie wiedziec to starac sie pomoc ale jak wziac przy metr;3
295;unikac na cwiczenia nic sie nie robic ni e sie;3
296;laborka lekki latwy i przyjemny nie miec problem z zaliczeen z sprawka mozna sie trochy spoznic nic sie nie stac w semestr kilka prosty kartkowka ktory i tak mozna poprawic ocena dosc wysoki;2
297;szermierka moc byc b rzeczywiscie jak na on wiek kondycja miec imponujacy ale lubic tez sie to bardzo chwalic i troche wywyzszac jesli chodzic o zaliczenie ten byc tez na koniec pokaz w pare niestety nie brac on pod uwaga a szkoda mozna miec jeden nieobecnosc kazdy nastepny ocena w dol;3
298;doktor rycerz kurs chemia nieorganiczny laboratoruim tak sympatyczny czlowiek z swieca szukac zajecie byc bezstresowy na temat ocena zawsze mozna podyskutowac na kazdy laboratorium byc wejs c;2
299;pan magister to czlowiek ktory doskolale rozumiec student i wraa jaki kolwiek klopot potrafic przerwac i powtarzac dany zagadnienie na skutkuo tablica wyrywkowo ale zeby nie dostacc plus to trzeba sie wysiic gdyz przy tablica wszystko podpowiadac d gdy sie odmowic podejscie do tablica co byc straszny glupota otrzymywac znak zapytac taki jakby minus ktory oczywisc nie byc brac pod uwage d natomiast plus to jeden punkt do kolokwium czastkowy przy ponad powyzsz ocene o pol stopien d zabawny z poczucie humora czesto nasmiewal sie z typow zadan tudziez profesorow ktorzy on ukladac d gdyz potrafic wytlumaczyc oraz atmosfere zajec a pan magister posiadac przydomek mianowicie jastrzab d naleza do nie liczny matematykowa ktoriez najpierw piszac zadanie a potem mysla a nie na odwrot jak to sie niektory zdarzac p;2
300;a wiec pan doktor wodka byc czlek wyjatkowy zawsze pomoc a jak cos on nie wychodzic to strasznie sie zalamywac i konsultowac sie z profesor dr hab inz walkowiakiem bardzo lubic zadanie z krotki tresc bo ten z dlugia byc za dlugi goraco polecac wszystek ktozy chciec doswiadczyc spotkanie z czlowiek ktory chemie kochac jednak miec pewien problem z przekazac ten milosc d chodzic o cwiczenie bo laborek z on nie miec em przyjemnosc odbywac;2
301;machnikowski pawel doktor inz fizyk h cwiczenie polecac b rozwiazywac sam zadac z list od prowadzacy wyklad oczywiscie mozny sie zglosic i dostac uwzgledc on przy wstawianie ocena na kolo dawac podobny zadanie co na lista nawet ten sam nie miec problem z zaliczenie czas sprawdzac obecnosc ogolnie byl na cw raz i zaliczyl;2
302;kurs finanse firma polecac b wyklada SA prowadzic bardzo ciekawie i rzeczowo mozny sie sporo dowiedziec na zajeci naleza byc cicho osoba gadajaca i przylapac moge miec obnizc ocene zaliczec za obecnosc;2
303;na kurs wystaczyc byc raz na pierwszy zajecia aby wziasc temat praca w srodek semestr aby oddac praca na koniec po wpis kurs ogolnie ciekawy prowadzic tak aby student nie zasnac;2
304;doktor borkowski burnecki chemia nieorganiczny i cwiczenie polecac b pani doktor to osoba na pozor grozny nic bardzo bledny byc to osoba bardzo sympatyczny na zajecia mozna nauczyc sie baaaardzo duzo zaliczec przedmiot byc kolokwia ogolnowydzialowy wiec nie moge napisac jaki poziom trudnosc zadanie dawac za zaliczeni jak chodzic o pomoc indywidualny na konsultacja pomoc w miary mozliwosc tlumaczyc bardzo dobrze ten opinia nie byc tylko moj jezeli miec mozliwosc zapisac sie na zajecia z pania doktor to polecac serdecznie;2
305;polecac wzor wykladowca potrafic przekazac wiedza w logiczny sposob a przy to nie brak on poczucie humor;2
306;ja rowniez polecac byc bardzo fajnie wystarczyc chodzic do tablica zadanie z lista a juz ty lubic bardzo pozytywny facet dac my nawet numer komorka ze jakby byc miec problem z zadanie to miec dzwonic raz nawet rozwiazac niezrozumialy zadanie w dom zeskanowac i wyslac my na mail zdanie na kolo bardzo podobny do ten co na lista nie lubic sciagajacy ale byc w porzadek nawet jak zlapac nie zaliczyc tylko chlopak ktory to sie nalezec goraco polecac;2
307;kurs chemia organiczny i cw ocena moc byc b elstako troche przesadzac imho co prawda pan doktor rzeczywiscie byc mily dla dziewczyna ale bez przesada ocena podciagac nawet o w stosunek do wyklad na cwiczenia byc spokojnie chociaz czas wyciagac na sila do tablica ocena neutralny nie byc zle;3
308;bardzo sympatyczny klopot z zaliczeen takze nie miec zaden bywac ze nawet obecnosc na cwiczenia nie byc obowiazkowy niestety z zrozumienie tresc przekazywac przez p pawlik miec em naprawde duzy problem skrypt lub ksiazka obowiazkowy jak dla ja zajecie prowadzic zbyt chaotycznie;3
309;wyklad ciekawy jezel ktos to interesowac mozna duzoc sie dowiedziec obecnosc nieobowiazkowy zaliczec strona internetowy wymyslony firma lub biznes plan jesli w miary okolo to bez problem biznes plan;2
310;witac rowniez polecac doktor mulak kola SA naprawde schematyczny na poprawka ten sam zadanie co na pierwszy termin a nawet taki sam jak rok wczesni troszke nie sympatyczny powierzchownosc brac do tablica i wstawiac minus p ale ostatecznie skala punktow zostalac dostosowac pomyslnie dla wszyscy pan;3
311;zupelnie sie zgadzac z kolezanka dodac tylko ze za obecnosc na wyklada w dzien swiety mikolaj podnosic ocena o pol stopien a jeslichodzic o zaliczenie to podac my okolo pytanie i potem wybrac i dac on na kolo d d;3
312;kurs analiza matematyczny i i ii wykladc numer b oto najciekwszy prowadzak z jaki mial stycznosc na pwr facet z zmojski akcent jak ktos on kiedys okreslil lubic straszyc czlowiek na pare pierwszy zajeci tekst w styl stud i;2
313;w wemif wykladc bardzo nudny dac sie wytrzymac ten h jak miec fajny gra na komorka albo karta i ekipe do poker nie kolokwium referat podwyzszajak ocene brak z on zartow smiejedziec sie tylko on sam student smiejac sie z on wredny meczacy ale spokojnie do przejscie mozny on olewac ale musiec byc cisza dobrze posiedziec ten h na wyklad i pouczyc sie na cos inny bo sprawdzac par raz w semestr obecnosc kolokwium zaliczyc kazda z dobry sciaga ksiazk encyklopedia przy siebie;3
314;bezproblemowy zaliczec na koniec wystarczyc w odpowiedni termin oddac praca na jeden z podac przez on temat lub na jakis inny dowolny zwiazac z wyklad forma dowolny referat rozprawka opowiadanie dialog nawet wiersz objetosc okolo strona maksymalc dwa oddac w termin w indeks na zajecia sprawdzac obecnosc ale sprawdzac byc wyrywkowy na pierwszy zajecia czytac wszystek pozno wybrac jesli wyczyc nieobecny to ten osoba na byc czytac na kolejny zajecia niektory udawac sie dziek ten system nie byc jakis raz bez konsekwencja d z to co pamietac ten maksymalc moze byc miec nieobecnosc co do sam wyklad pan doktor kaluszynski mowic bardzo cicho spokojnie i lekko monotonnie czas zdarzac sie ze w polowa zdanie zrobic siebie jakis pol minutka przerwa d ogolnie jesli sie chciec to calkiem przyjemnie sie sluchac choc atmosfera nie sprzyjac skupiec w zasada mozna na wyklada robic co sie kto podobac byle by glosno nie rozmawiac strasznie sie na ja wydrzec za to na jeden z wyklad byc em w szok shock wiekszosc czytac ksiazka rozwiazywac jakis zadanka albo po prosty sie uczyc polecac i na odbebnieie humana i na posluchac wyklad;2
315;graficzny zapis konstrukcja wyklad elektryczny nudny pokaz slajd na zjeci nie pospic ani nie porozmawiac bo straszy wyrzucen z sala zapisywac nazwisko etc sprawdzac obecnosc byc moc tak uczyc jednak rzecz ktory nigdy sie nie przydadzic na przyklad rysoowac sruba bez uproscic kolokwium zaliczac brak podobno dawno byc zero tragedia student szkodnik unikac za wszelki cena jesli czytac ten post prawdopodobnie byc z elelktryczny a to oznaczac ze ten pan raczej nie unikniesz pozaostawac zyczyc wytrwalosc zaliczyc byc niesamowica ciezko na i termin zdac okolo osoba na na ii tylko dopiero na byc w miara luz i wtedy zdac najwiecej osoba byc jeszcze iv i dla niektory v jesli nie zaliczyc es na i termin to brac pod uwaga obecnosc obecnosc decydowac rowniez o trudnosc na III termin jesli nie byc ty wiecej niz raz to dostawac byc grupa;1
316;kurs przyrzad polprzewodnikowy laboratoria ocena polecac doktor byc bardzo mily czlowiek czesto pomagac przy cwiczyc na kazdy zajecia obowiazkowo wejsciowka nie liczc ze zapomniec kartkowka oceniac sprawiedliwie widac ze chciec by byc to zrozumiec a nie ryc na pamiec instrukcja po kartkowka wstep do cwiczenie ktory moc trwac calkiem dlugo wiec radzic sie spieszyc z cwiczenie na szczescie nie trzeba caly cwiczenie robic wystarczyc kilka podpunkt sprawka rzaadko zwracac oddajemy on na zajecia trzeba bardzo slabo napisac zeby byc problem na koniec ocena sprawiedliwy;2
317;  prawo europejski w taki siebie on ciagle mowic cytowac kodeksy ty notujec jeden kolokwium koncowy radzic przygotowac sciagi i praca na wybrac z tu temat minimum str a na podwyzszc ocena o jeden stopien dosc specyficzny szczegolnoe zartowac siebie zgryzliwie z student ktory on przeszkadzac okolo polecac nie miec problem z zaliczeen;3
318;pan arkadiusz zwykle przepuszczac wszyscy bez duzy problem niestety miec problem z chodzen na zajecia ja to co prawda nie przeszkadzac ja miec identyczny problem ale jednak moc by nieco malo olewac student egzamina zwykle do latwy nie naleza ale i tak przepuszczac;3
319;profesor j skarzewski chemia organiczny i chemiy organiczny ii polecac b wszelki problem wykladac w trakt zajecia tlumaczony byc klarownie nie miec zaden problem z zrozumienie chem organiczny i latwie byc zaliczyc ale to u wszyscy prowadzic w kolokwia zaliczec oba czesc chemia organiczny byc dwa kolokwiac w przypadek ch org ii byc jeszcze dwa termin egzamin zasada byc prosty na kolokwi zadanie byc z cwiczenie na egzamin zadzi pan mastalerz dla niewtajemniczony ulubiic ksiazka pan prowadzacy profesor skarzewski to czlowiek sympatyczny chociaz w przypadek ocen nie proponowac by metr zaden dyskusja no chyba ze z na polecac;2
320;ocena goraco polecac wyklad w zrozumiac i na temat na cw dobrze tlumaczyc jak sie ktory zadanie robic zaliczenie polegac na napisanie kolo trzeba miec by zaliczyc problem brak;2
321;doktor anusiak jan analiza w ocena srednio b tak jak poprzednik pisac pan doktor uczyc slabo ale jezeli trochy sie czlowiek pouczyc to kola powinien spokojnie zaliczyc czas pan doktor lubic sie zdenerwowac w akcja raz on widziec em dobrze nie zadzierac ale zeby on wkurzyc trzeba naprawde duzo skakac po lawk podczas kolo doslowc na kolo dal masakryczny zadanie bo na wszyscy zaliczyc ale nie bylo zle a trzeba pamietac ze nie lubic zwalanie to unikac jak burza;3
322;angielski b byc sympatyczny zajecia wygladaj tak ze dzielic na para i kazac z sobac gadac na zadany temat czas zrobic cos z ksiazka zaliczenie spokojnie;2
323;babka byc sympatyczny ale na zaliczen trzeba cos umiec;3
324;kurs analiza cw ocena polecac przed kol m co na on bedzie a co na pewno sie nie pojawic moze nie dawac super latwy zadan ale sposob oceniac byc dosc przyjazny student polecac;2
325;analiza swietny wykladowca pasja ciekwostka humor swietny podejscie do student;2
326;analiza kurs powtorkowy cwiczec algebra liniowa wyklad ocena pozytywny wydzial chemiczny zajecie bezstresowy analiza cw to byly drugi realizacja ten kurs i doktor jako osoba jedynie uzupelniajacac wiega dobrze sie sprawdzil bardzo mily to bylo rok temu i jeszcze nikt on sie wtedy nie narazil zadanie na kolokwi do rozwiazac roznily sie jedynie dane od zadan ktore dostalismy do dom jak przykladowy jesli ktos on wczesni rozwiazal kolokwium napisal spokojnie algebry wykladc dobrze przeprowadzic dal podstawa do zdac egzamin cw prowadzilac pani doktor sulka i niestety prawie nikt nie zaliczyl w kolokwi;2
327;opinie na podstawa kursutematyczny cwiczec na wydzial w wemif na cwiczenie idzesz by pocwiczyc to co miec umiec jak nie umiec pani ty moze podyktowac zadanie jak miec dobry humor jak zly to dac minus i siadac jesli sie on zechciec powec cosa wartosciow kolokwi z grupa o sredni i wysoki stopien trudnosci zapowiedziac nie za prosty z co pan smiac sie mozny jedynie z sposob w jaki sie pani doktor smieje dst unikac na poczatek dobro rada jesli mozeec to unikac zdanie na kol moze nie SA kosmicznie trudny choc bywaja taki to do latwy nie nalezaec na cwiczenio za duzo nie wytlumaczyc bo uwaza z od tlumaczec byc wyklad u ja w kol zaliczylo osob dla porownac na egzamin przeszlo dodatkowy z on grupa cwiczeniowy no lekko nie byc jak do ten pani trafic szykoj sie na sporo nauka i modl sie o jeden z ten prostrzy grupa d;1
328;kto profesor w walkowiak kurs chemia nieorganiczny i i ii wyklad ocena bardzo polecac b pan profesor byc bardzo mily i miec duzy wiedza wyklad byc naprawde ciekawy a z zaliczeen nie miec zaden problem wystarczyc zaopatrzyc sie w magiczny konspekt na podstawa ktory prowadzic byc wyklad jesli chciec umiec chemia nieorganiczny i dobrze on zaliczyc polecac;2
329;kurs angielski b e polecac b sposob prowadzic zajec calkowicie bezstresowy i przyjemny chyba z stresuja cie gra typ kala m;2
330;bardzo polecac zarabisty koles wyklad nawet ciekawy ale z czas robic sie nudny gdyz ile mozna gadac o program zaliczec wyklad na podstawa ekranowka ale on byc napisac chyba przez doktor paluszynskiy ekanowka masakaro byc tak napisac by ty pokazac co nie umiec masa pulapka i wyjatek p ale mozna zaliczyc byc w necie pan miec em z ten pan takze labork i cwiczenie tu wielki plus na poczatek rzeczowo przedstawiac problem omawiac jak byc nie przygotowac to nic ty nie zrobic potem czas wolny jak cos nie wiedziec to pomoc miec po prosty zdrowy podejscie do zycie i student p program oceniac sprawiedliwie jak sie przylozyc to sie duzo nauczyc ahao i jeszcze jeden lubic sie spozniac;2
331;opinie na podstawa kurs wykreslny na wydzial is sposob prowadzic zajecia zrozumiac czy potrafic nauczyc tak podstawa ocena w indeks zaliczec egzamin jesli z cwiczenie przynajmniej przepisowac ocene niespodziewajka brak poczucie humoruz ogolny podejscie do student neutralny dobrze postarac sie o z cwiczenie bo egzamin duzo trudniejszyc ogolnie pozytywa;2
332;wyklad k k byc po prosty genialny miec niesamowity dar przekazywac wiedza i tlumaczenie a tlumaczyc do opor cwiczenie tutaj warto byc przygotowac i blyskac na kazdy zajecia tak zeby ty zapamietac nie nalezec jednak ulegac pozor i tak rozliczyc sie z wy na egzamin a tu moc byc roznie zaliczec z regula z egzam wystarczyc ale nie miec zmilowac sie pouczyc sie i tak trzeba ciezko tez o przedluzec sesja lub podobny kombinacja alpejski po sesja tylko dwa wyjscie albo z tarc z;2
