;text;target
215;  nie wszystko sie rozumiec ale jeszcze dac sie wytrzymac przecietnie jak sie postarac to sie nauczyc kolokwia czastkowy odpoweidzic ustny trudny trzeba sie uczyc ale mozna metr w przewidziec co byc nie miec zaden przyjazny student tez czlowiek moc byc kobieta w miary spoko byc duzy formalistka i na kolokwi trzeba sie pilnowac duz plus to dodatkowy punkt za aktywnosc jesli ktos sie troche pouczyc to zaliczyc bez problem bo no kolo SA zadanie raczej standardowy polecac przecietny tak problem byc przedstawic klarownie kolokwiac czastkowy latwy jesli sie czlowiek uczyc nie miec zaden w norm przyjazny student tez czlowiek polecac miec na imie agnieszka nie Teresa tak sie przedstawiac na pierwszy zajecia corka nie podac sie do matka na wyklada byc spokojnie rozwiazywac na tablica mnostwo przyklad ktory w wiekszosc mozna zrozumiec na kolokwium dwa zadanie prosty dwa trochy trudny ale wszystek zgodny z przerobinymi na zajecia nie identyczny nie miec limit punktowy z jeden kolokwium jesli trochy brakc do zaliczec to na dopytke polecac;3
216;moc byc dla ten co chciec zdac w kolo i potrafic sie sam nauczyc otoz doktor mierczynski byc straszny dziwak miec wlasny system oceniac zadanie czyli udejmowac punkt jak cos byc zrobic tak jak on nie lubic mozna on poznac ale tylko czesciowo chodzec na wszystek wyklad a wykladac nieciekawie nudno starsznie mozna usnac bowiem po prosty przepisowac skrypt tylko czas dodawac cos od siebie kolo dosc prosty na wyklad czas wskazywac jaki zadanie byc i byc potem ale to tylko jedyny on atut w ogol z on nie pogadac chyba ze chciec tylko zobaczyc praca lub pogadac o matematyka sprawdzac kolo i egazmina bardzo szybko wynik byc w ciag okolo doba czas nawet szybko na on stronka pan;3
217;kurs rosyjski a a e numer b miec em z on semestra byc zajebista atmosfera na zajecia doskonac potrafic nauczyc zrozumiec nie spieszyc sie z robiyc material czesto wracac do trudniejszy rzecz byc trochy sluchac troche ogladac material to glownie ksiazka pawac c;2
218;doktor wojs rzadko bywac na zajecia ktory prowadzic gdyby nie to ze byc bardzo szanowany naukowc i polowa swoj nieobecnosc moc wytlumaczyc daleki podrozami i slawieen dobry imie nasz uczelnia byc by beznadziejny wykladowca a tak sila wysoki wszyscy byc z on dumny nawet ja z zaliczeen nie robic problem ale na wysoki ocena trzeba juz umiec przerazajacy rzecz wyklad byc ciekawy choc nie zawsze dokladny i przejrzysty co wprowadzac spory zamieszanie z wzglad na niewielki problem z zaliczenie polecac wszyscy dla zdolny student tez byc to ambitny wybor;3
219;cw ocena polecac b polecac nie byc zle na cwiczenia robic krotki wprowadznie do temat i czas przyklad brac do tablica i stawiac pulsy i minus jezeli ktos wziac i ten ktos nie zrobic zadanie duez czesc grupa zaliczyc w kolokwi;2
220;kurs przyrzad polprzewodnikowy labolatorium ocena nie miec dobry goraco polecac byc to przyklad osoba jak bardzo pozytywnie nastawiony do student co prawda kartkowka robic ale prosty i z zagadnienie z instrukcja zaden wymyslny wynalazek jezeli kartkowka ty nie pojsc to i tak moc przystapic do zajecia nie wyrzucac tyle ze kartkowke ladnia opracowac bedzie trzeba przyniesc na nastepny zajecia pani wszystko co trzeba zrobic wypisowac na tablica i pokazywac do to mozna sie pytac o wszystko sprawozdanie zadko oddawac do poprawka ale wiedziec ze kilka osoba sie zdazyc sprawozdanie mozna oddac pod koniec zajecia albo na nastepny a w rzeczywistosc nawet duzo pozni i mimo wszystko mozna dostac dobro ocene ogolnie jak bardzo sie zapisywac d;2
221;pan docent byc swietny czlowiek wyklad byc prowadzic w bardzo przystepny i ciekawy sposob mozna sie sporo dowiedziec egzamin faktycznie byc dosc trudny ale na poprawo zwykle byc ten sam zadanie ewentualnie zmienic dane albo przemieszac grupa co na termin podstawowy warto tez przejrzec egzamin z poprzedni rok pytanie sie zawsze powtarzac ogolnie baaaardzo polecac;2
222;lab ocena polecac bardzo sympatyczny skory do pomoc prowadzic luzny atmosfera oceniac raczej na plus;2
223;  d bardzo fajnie prowadzic zajecia ocena byc za obecnosc wiec warto chodzic mozna sie przy okazja nauczyc dobrze tanczyc co kiedys moc sie przydac naprawde polecac d;2
224;pan Merdas posiadac niestety tylko tytul mgr nad co nieustannie ubolewac kurs analiza ii u ten pan wspominac dobrze z wsztstki matematyk na polibud niesamowity poczucie humor ciaglec wstawka dla rozsmieszec towarzystwo i tak dalej wszystko byc jasny prosty i klarowny czesto zdradzac jaki zadanie znajda sie na kolokwium a juz na pewno podac dokladc typ;2
225;kurs finanse firma polecac b jak wysoko wyklad calkiem ciekawy pan doktor dobrze wiedziec ze humac na polibuda to nie byc wazny sprawa dlatego nie robic zaden kolokwium ani problem z zaliczenie wystarczyc chodzic na zajecia na kazdy zajecia sprawdzac obecnosc ogolnie bardzo fajny human do odklepac a jak ktos sie chciec cos jeszcze nauczyc to myslec ze wyniesc calkiem sporo z wyklad;2
226;wedlug ja jeden z dwoch dobry wykladowcow zaraz po cichoniu wykladac tak aby student zrozumial mial z on tylko algebry a jak sie byc aktywny tzn sluch sie to co mowi i czas cosc swoj dorzuci to latwie sie rozumiec a potem na egzamin albo raczej;2
227;fizykac h loboratorium elektronik air no na laborka to akurat nie miec co uczyc ale tlumaczyc nie potrafic mota sie nie pamietac co zrobic w jaki cwiczyc kartkowka w duzy stopien sprawozdanie ogolny wizerunek student bardzo rozny ale banalny z podstawa albo z cos co w ogol nie miec w instrukcja oj raczej brak starac sie byc mily miec m z ten pani kurs w semestr zimowy pani dopiero zaczynac wtedy uczyc i tak wlasciwie nie wiedziec jaki swoj wizerunek miec wykreowac na poczatek wydawac sie grozny ale kartkowka dawac banalny i wszystek osoba w grupa miec ten sam ptanie i siedziac obok siebie potem okazac sie bardzo mily ale zaczac przesadzac z kartkowka porozsadzac my dawac jakis pytanie nie z instrukcja a nawet zadanie na koniec wymyslic kartkowka z liczyc blad sprawozdanie w zwracac najczascie za pierdola pani niezmiernie pedantyczny szczegolnie w wniosek czepiac sie dobierac slowo blad ortograficzny i interpunkcyjny a nawet powtorzenie wyrazowych sprawozdanie musiec byc sliczny i przejrzysty i choc byc czep i;3
228;fantastyczny kobieta od raz widac ze z uniwerek a nie z polibuda zajecie odbywac sie w mily atmosfera wszystko mozna zrozumiec oplacac sie przed zajecie zainteresowac sie zadani z skrypt i zglaszac sie na cwiczenia przekladac sie na ocena koncowy ciezko nie zaliczyc w kolokwia zwlaszcza jezeli tydzien przed kolo zapytac sie grzecznie jaki byc typ zadanie i przygotujedziec siebie odpowiedni pa e;2
229;ocena wybraniec bog kurs filozofia spoleczny inny brak w ten rok nawet x w tydzien nie znac osoba ktora nie bylaby zadowolony po ten kurs ksiadza irka niesamowicie prowadzic zajecie pomimo z nie sprawdzac obecnosci dawac za nia ocene i byc to w praktyka byc krotka rozmowa z on po ktory miec sie a tak naprawde on mowy student sluchajac jak juz mowil nie sprawdzac obecnosci a prowadzic tak ciekawie z czlowiek i tak przychodza ciezko sie dostacc na on kurs dopiero w ten rok miec dwa termin jak sie miec pierwszy dzien zapis po to mozny juza zapomniec o wolny miejsce polecac;2
230;dzieki on jeszcze byc student pan;2
231;podstawa chemia ogolny wyk lab ocena nie miec zdanie b wyklad sprowadzac sie do czytac wyswietlany slajd ktory i tak byc na necie laborka zas prowadzic w surowy atmosfera dawac okazja do wiele smiech z szorstkiego i grozny podejscie profesor apostoluka do temat bron bozy zeby uslyszec ten smiech przyklad student zbic kolba wystraszony pokazywac on profesor a ten odpowiadac bardzo groznie wyrz u;3
232;doktor radojewski beaty wprowadzic do informatyka wyklad multimedialny technika komputerowy labork ocena sredni b urlo httpwwwntifpwrwrocplkwazardefaulthtm portalik edukacyjny kwazar pod redajca doktor beata radojewski urly byc to taki dwa kurs ktory zdecydowanie by metr skreslic z lista przedmiot nikt nie wiedziec po co on i na co kto wyklad byc tragicznie nudny z wyjatki jeden o fraktal wyklad zaliczac sie test wielokrotny wybor wszyscy wiedziec jak beznadziejny byc taki test sprawdzajace wiedz z informatyka na laborka moc juz nie byc tak nudno bo sie bawic glownie fotomontaz ale za to byc wyscig szczor kto pierwszy skonczyc zadanie dostawac wiecej punkt niz pozostaly ostatni zadanie to napisac stryc internetowy na zadac tematyka ogolnie miec bardzo niesprawiedliwy system oceniac poniewaz zdolny studenci ktory miec tyl z programowanie nie miec szansa na dobry ocena;1
233;w wemif wyklad beznadziejny nie potrafic byc beznadziejny kolokwia i poprawka kolokwiow ciagle robic kartkowka ale nie wstawiac ocena brak beznadziejny beznadziejny beznadziejny unikac uciekac za wszelka cene mowi tak szybko i niewyrazc z nie miec szansa zrozumiec w jaki jezyk wogole mowy byc chaotyczny do bol wyklad polegac na wyswietlaniu na ekran prezentacja z metr powerpoint ten prezentacja pisac sa beznadziejny i tylko pani irenka znany jezyk stanowczo odradzac bo byc wielki problem z zaliczeen kolokwi sa trudny materialy beznadziejny a zdawalnosc w kolokwi na poziom a ogolc okolo unikac jak ogien;1
234;kurs analiza wyklad ocena moc byc wyklad prowadzic byc bardzo szybko pan doktor potrafic przepisywac caly definicja z skrypt rozpatrywac wiele typ zadanie ktory sie pt przydadzic na kolokwi niestety czas sie nie nadazac z przepisywaen poza to pan doktor przypisywac duzy rola do definicja wszelki zadanie na kolokwia zaczynac sie wypr o;3
235;tomala Malgorzata mgr kurs angielski b moc byc b wiekszosc czas to konwersacja w grupa czas kilka zdanie do napisac test nie za trudny jak ktos miec wczesnie angielski to spokojnie zaliczyc ogolnie polecac;2
236;kto metr rutkowskac co ekonomia wydzial ppt wyklad nudny z spac nawet odechciewac brak niewspodziewajek egzamin zalezec od szczescie mozna miec wiega i miec powolac do b na jak to mowic indywidualny odpytke czyli nie zaliczyc i tak sie scierac dla marny zaliczenie a mozna kompetnie nie miec wiedza i zaliczyc na wszystko zalezec od szczescie btw nie zdziwc sie jak nawet wy nie zapytac i odraz kazac isc na pielgrzymke do b;1
237;polecac infa cw babcia byc zajebista polecac latwo u on zaliczyc i nawet dobry ocene dostac;2
238;wyklad i cwiczenie byc klarowny bogdan to czlowiek pozytywnie zakrecoc z zaliczec problem brak jak umiec cokolwiek bardzo polecac;2
239;pani troche stary data wiec miec okreslic juz zasada ktory sie trzymac mianowicie miec on konkretny pomysl na sprawozdanie i dobrze oddawac on wykonac wedlug konkretny wzor dobrze kiedy dostaniesz pierwszy zwrocic sprawozanie to leciec na konsultacja i pytac sie jak to miec wygladac a potem poprawo zgodnie z sugestia gwarancja ze do koniec laborka wszystko byc juz przyjac bez problem uwagac dwa pierwszy sprawka obowiazkowo reczc reszta na komputer pytanie podczas laborka potrafic byc ciezki mozna wyleciec na sam koniec laboratorium ale z regula moze grupa beda zapytac podczas caly zajecia przy okazja zaliczenie warto pojeczec o wyzeki ocena duzy szansa powodzenie;3
240;musiec sie przyznac ze bardzo nudzic em sie na wyklada u pan michec dlatego na przerwa wybyc em i duzo sie tam nie pojawic em jesli ktos umiec juz troche programowac to nie widziec przeszkoda zeby sie do on zapisac mozna umowic sie na oddac wielki projekt i wcale nie chodzic na labork z drugi strona jesli ktos nigdy nie miec kontakt z programowaen to musiec sie przylozyc bo nie zaliczyc jesli wiec nigdy nie programowac es zapic sie do ktos inny;3
241;przerabiac zadanie na zajecia w postac analogiczny pojawiac sie na kolo pani doktor odpowiadac na wszystek pytanie student i miec duzo cierpliwosc do poprawka tlumaczyc dokladnie ten sam co na wyklada czas nawet w lepszy przystepniejszy sposob dzieki on nie musiec em isc na egzamin z analiza i;2
242;kurs podstawa statyka pani bryja prowadzic zajecia w sposob bardzo zrozumiac ale jednoczesnie byc wymagac kolokfia byc trudny ale do zrobic polecac jesli chciec sie nauczyc podstawa statyka projekt miec bardzo znikomy wplyw n ocene koncowy poprawiac kolo moc raz ale dopiero w sesja przepadac ty zerowy termin z statyka wyklad;3
243;bardzo polecac d znakomicie wykladac dodatkowo zadbac by rysunek i wzor z wyklad byc w necie i my zostac tylko notowac co mowic bardzo dobry podejscie do zycie byc po prosty ciekawie no i ten radosny atmosfera towarzyszaca przemowo doktor polak d a zaliczec nic prostszy na kolo powtarzac sie zadanie z poprzedni rok zaliczyc mozna uczyc sie minuta czytaj studiuc zadanie z poprzedni rok;2
244;kurs algebro z geometria analityczny wyklad strasznie zakrecony czlowiek na wyklad pisac niewyraznie i strasznie mieszac na szczescie nie olewac student i reagowac na sugestia bardzo przystepc tlumaczenie;3
245;kurs analiza matematyczny bardzo dobry i wyrozumialy wykladowca bez problem przekazywac swoj wiedza zajecie prowadzic interesujaco i wogole byc super jezeli chodzic o kolokwi to sam skrypt nie wystarczac ale jezel sie pracowac i on to widziec to z zaliczeen nie miec problem takze goraco polecac po prosty super gosc dawac on;2
246;jak poprzednik koles dosc mocno zakrecony ale w porzadek isc sie z on dogadac zadanky w miary prosty pouczyc sie troche z zdac na pewno;2
247;pan doktor byc specyficzny osoba ogolnie labork przebiegla bezstresowo a sprawozdanie chyba nikt nie oddac kartkowka tylko na poczatek z obliczac blad pomiar zrobic z co na wszy tylko osoba zaliczyc dawac na on minuta wiec warto obryc szybki przeliczanko w sprawozdania zwracac uwaga tylko i wylacznie na wniosek od bieda jak byc wykres to na on zerknie oddac em z kumpl to sam sprawko tylko w wniosek dopisac em dwa zdanie on dostac a ja czas popyte ale albo nie wpisowac ocena jak kiepsko pojsc albo dawac mozliwosc poprawa odpowiedz glowny mankament byc to ze pan doktor ni hu hu nie wytlumaczyc w jasny sposob jak przeprowadzic dane doswiaczec czas rzucic argument ze na ten sala juz miec smy zajecie wiec wszystko wiedziec i wychodzic na caly zajecie czesto nie miec kto zapytac jak nie wiadomo o co chodzic lubic konczyc sporo przed czas jak wiekszosc osoba sie uwic w godzine laborka miec godzinka to pogania ten ktory jeszcze nie skonczyc czas daruc on pomiar ale w sprawk on wymagac heh drugi mankament byc to dziwny ocenianie sprawozdanka przez ktory w moj grupa cwiczeniowy najsprawniejszac w ten temat osoba dostal a dziewczyna srednio kumaj o co chodzic p s Jesli pojsc sie do pan doktor o podwyzszec ocena a on sam nie zaznaczyc z istniec taki mozliwosc to potrafic swinski numerek odstawica na przyklad z liczen bledu pomiar wymiarow pokoj w ktory rezydowac za pomoca linijka ja sie udac skonczyc z piatek raczej malo byc moze jeden;3
248;wyklad byc okolo jak sie sluch pan stadther to mozny odniesc wrazenie z powinien byc mianowac na glowny finansisty kraj setka analiza prywatyzacja konkursowo na dyrektorow opowiescic o pesej wiekszy niz tysiac zaliczec przez obecnosc ale dobrze nie rozmawiac na zajecie i nie rozkladac sie na lawa w cel drzemka;3
249;doktor anusiak kurs podstawa analiwy matematyczny cwiczenie ocena jak chciec zaliczyc bez wiekszy wysilek polecac b dla osoba ktory nie wiazac przyszlosc z matematyka czyli taki jak ja przyszly chemik nauka analiza nie byc priorytet w zycie do co dazac zaliczec u pan doktor nie byc duzy problem gdyz na kolokwi mozna miec wszystek notatka jezeli chciec sie cos duzo nauczyc albo cie to interesowac i chciec w jakis glebszy sposob poszerzyc swoj matematyczny wiedza zapic sie do ktos inny dodac jeszcze ze jak brakowac ty na przyklad punkt do zaliczec w kolo a na zajecia chodzic es to miec w kieszen;3
250;naprawde swietny prowadzacy przed wszystko uczyc matematyka w odpowiedni tempo i dobrze tlumaczyc do kobieta rzeczywiscie podchodzic z wyjatkowy uprzejmosc oraz odpowiedni humor ale miec pewien zasada jezeli ktos czesto biegac do tablica to na koniec zajec przy zaliczenie w kolokwia podciagac ocena czyli dziewczyna powinien sie uodpornic na czas chamski wrecz tekst bo na koniec on sie to oplat kolokwiac niezbyt trudny jesli czlowiek sie uczyc ogolnie ekstra ps powyzsz opinia dotyczyc analiza bo wyklad z algebry byc ostatni w sroda i pod koniec listopad sam rozumiet;2
251;poczucie humor b dobry wyklad ciekawy i zrozumial minus SA test a dokladni on poziom choc nie miec sie co martwice niezaliczen w pierwszy termin bo w drugi byc latwo poza to wszyscy zaliczajac;2
252;na laboratorium byc wejsciowka ale nie byc on jakos bardzo trudny mozna sie do on spokojnie przygotowac korzystac tylko z instrukcja do laboratorium w dodatek jezeli nie zaliczyc kartkowka to i tak miec zaliczc laboratorium pozno musiec tylko do on pojsc na konsultacja i zaliczyc sam wejsciowka na odrobka wysylac tylko ten ktory nie byc jesli ktos zlapac na sciagac na wejsciowka albo jezeli cwiczenie zostac zle wykonac ale to trzeba sie bardzo mocno postarac wink co do ocena na koniec to wyliczac on jaki srednia z wszystek sprawozdanie i wejsciowka i zazwyczaj podciagac on troche do gora co zas sie tyczyc sprawozdanie to generalnie oddawac sie on na zajecia ale jak sie nie zdazyc to mozna spokojnie dokonczyc on w dom ogolnie bardzo ja sie podobac laboratorium z pp byc bezstresowy i ocenka jak bardzo sprawiedliwy;2
253;mulak grazyna doktor hab inz fizykac wyklad b tyle pozytywc o ten pani moc napisac ze przepisowac ocena z cwiczenie lub wiecej nie za duzo chodzic metr na wyklad bo usnac nie trudno a ja szkoda czas na spac poza doswiadczenie nudno monotonny glos zero poczucie humor egzamin podobno nie az taki trudny choc wiele zmagac sie w termin ogolnie sporo termin robic wiec w koniec mozna zaliczyc slyszac m ze lubic lac woda;3
254;kurs laborek z miernik ocena polecac jezeli miec jakis pojecie o miernictwie nie wiedziec jak na wyklada ale na laborka pani irenka okazac sie bardzo spoko byc po technikum i nie miec em zaden problem z zaliczeen laborka na trochy gnebic jeden koles ktory nie wiedziec nic ale jezeli czaic choc podstawa to nie bedziesz miec wiekszy problem zdac wejsciowka sie zdazac ale nie zdazyc sie zeby ktos za on wywalic z laborka jezeli wiedziec z nic nie napisac es to przygotowac sie na pytanie z wejsciowka w czas kiedy on on bedzie sprawdzac bo to byc bardzo brac pod uwage niz sam wejsciowka jezeli chodzic o ja to miec em lab z jagielnicki i szczerze to bardzo podobac ja sie zajecia z pani frankiewicz pozdro;2
255;fizykac i wyklad ja rowniez polecac egzamin zaliczyc wprawdzie dopiero na poprawo ale z chec zapisalam sie do on rowniez w ten semestr kawac naprawde dobry d jeszcze nie miec metr z on cwiczenie wiec zobaczyc cieszyc sie ze polecacie fizyk ii wyklad i cwiczenie naprawde bardzo bardzo bardzo polecac wyklad ciekawy cwiczenie rowniez doc rohleder nie wymagac obecnosc na cwiczenia nie wyrywac do zadanie wlasciwie nie wymagac nic a na zajecia zwykle frekwencja byc pelny lub prawie pelny potrafic wszystko wytlumaczyc nie denerwowac sie i szanowac student z zaliczenie nie miec raczej problem swietny czlowiek wink;2
256;oto przyklad jak nie powinien sie prowadzic laborki mowo tu szczegolnie o poczatk programowanie bo z ten przypadek mial nie bezposrednio stycznosc facet potrafic genialnie czlowiek ktorza maj sie to uczyc widac w dupa miec to co dziac sie na wykladzie bo czlowiek ktor nie znajac jeszcze podstawa c zadawac program ktore powinien sie pojawic po wykladzie a daleko byc juza tylko zle osobiska nie dziwiedziec sie z osoba majaca u on infe lub cos w podob nei uczac sie programowac bo zeby to zrobic musialyb przechodzic przyspieszony kurs w zwiazek z to historia zlecac zadan inny byc chyba u on powszechny ps w przypadek ten pan sluze pomoca jesli ktos chciec w miary bezstresowo on przejsce;1
257;ogolnie ocena za obecnosc mozna odbrabiac przychodzic w inny termin byc bardzo luzno na lina spedzic smy tylko pare zajecia jak ktos chciec to moc smigac po scianka tak tez robc byc troche praktyczny wskazowka i inny uczestnik byc fajnie;2
258;swietnie prowadzic zajecie bardzo fajny kontakt z student na kurs nauczyc sie wszystek podstawa wspinaczka a jesli juz umiec sie wspinac idziesz na scianka a byc sporo miejsce gdzie mozna sie wyprobowac nieobecnosc trzeba odrabiac z to co pamietac do trzy odrobka nie zmieniac ocena jesli miec wiecej odrobeka a byc jakis wazny powod mozna sie byc z prowadzic zajecie dogadac;2
259;opinie na podstawa kurs wytrzymalosc material i na wydzial is sposob prowadzic zajecia zrozumiac czy potrafic nauczyc tak podstawa ocena w indeks zaliczec kolokwiac niespodziewajka brak poczucie humor czas ogolny podejscie do student pozytywny goraco polecac wiedza sam wchodzic do glowa full termin na zaliczenie;2
260;Mroz Marcin mgr inz nie moze byc dobrze kurs fizyk laborka b co tu duza mowica chodzaki ideal zero wejsciowka jedynie krotki odpytanie po laborka z ktory licealisto dalba siebie rade lubic pozartowac pomagac w laborka oceniac bardzo wysoko nigdy nie zwracac sprawozdan ideal;2
261;  w trn lubiac byc sluchac i nawet jak na tak nudny dziedzina ktory sie zajmowac to czas wzbudzac moj ciekawosc ale miec em ten wyklad o nieludzki pora i czas wolec em siebie pospac jak ty to interesowac to moc duzo wyniesc koncowy kolokwium pytanie co to byc prawo i co to byc pozew referat podwyzszajak ocene minimum strona dac em siebie spokoj sprawdzac obecnosc ale raczej nie brac obecnosc pod uwaga znac czlowiek ktory nie miec zaden udokumentowany obecnosc a zaliczyc a inny brak opowiadac fajny historia z zycie jak latwo pozbyc sie tesciowy wink nawet nawet wydawac sie wredny ale w glab to bardzo mily czlowiek nie przeszkadzac nie miec problem polecac pan dawac ciety riposta i nie lubic gadac przeszkadzac i spoznianiac sie spoznialski stwaia w pierwszy lawka ale nie ponosic zaden odpowiedzialnosc prawny na poczatek wydawac sie ze byc trudno to zaliczyc gdyz byc duzo material do zapamietac ale to co sie dziac na kolokwium to byc poprost raj dla student sciagac sie dac jak malo gdzie wink przygotujc siebie multum sciag na kolo;2
262;doktor tadeusz Michalewicz polecac b doktor tadeusz nie tomac to bardzo fajny gosc prowadzic filo z;2
263;fizykac h fizyk h wyklad elektronik air suchy haslo i definicja to tak ale fizyka to szczerze watpie na h egzamin na h kolokwium wygladac identycznie test ktory byc prezentacja power point okolo pytanie n kazdy jakis sekunda trzeba znac minimum fizyka w wersja profesor radoy jak uczyc sie z ksiazka a nie z on wyklad to choc by byc nie wiedziec ile umiec ten kolo nie zaliczyc zeby napisac dobrze trzeba wiedza miec wykuta w s nie miec czas na dedukowac i rozumiec to trzeba poprost znac jak pacierz latwo wyczuc co sie uczyc to co naw wyklada byc powtarzac milion raz na przyklad dlac z;3
264;zaliczyc byc dosc prosto polecac umowic sie z znajomy i opracowac wspolnie wszystek podac zagadnienie a potem sie on dobrze nauczyc ocena byc wystawiac na zasada widz i;3
265;algebry linowy wyklad elektonik air a matematyka w ogol dac sie nauczyc na wyklada gdzie praktycznie byc sam teoria a tylko sporadycc przyklad ja tak nie potrafic wiec ja ten wyklad niewiele dac jesli ktos tak lubic to chyba mozna sie nauczyc bo wyklad merytorycznie dobrze prowadzic dwa kolokwi ewentulac punkt za obecnosc i praca dodatkowy prezentacja kartkowka i tym podobne typowo skryptowy ale ten trudniejsze raczej sprawiedliwie ale trzeba ladnie opra c;3
266;przyprzad pp wyklad ogolnie prowadzic byc dosc fajnie wszystko mozna zrozumiec tylko trzeba chodzic poczucie humor raczej zerowy po prosty wyklad i koniec na egzamin pytanie dosc trudny sprawdzac przekrojowo wiedza pytanie wybierac sie jednak na poprawka dawac dokladnie ten sam pytanie do termin polecac uczyc sie z zestaw pytanie ten lista byc dosc stary ale do dostac w kser i z on byc pytanie na egzamin ogolnie wszystko byc jasny i logiczny polecac;2
267;doktor inz wilk janusz podstawa inzyneri i mechanika precyzyjny w ocena srednio b wszystko by byc fajny gdyby nie ten kartkowka ktory byc i tak przewidywalny naleza wziasc poduche na wyklad bo pan Janusz co rok wykladac z ten sam notatka i robic sie wtedy bardzo nudnie z zaliczeen nie robic problem jak ktos nie zaliczyc w kartkowka to byc kolo sredni trudnooscic a jezec ktos nie zaliczyc kola to byc poprawa moj kolega teraz miec poprawy dal to sam co na kolo i wyszedl hehe;3
268;profesor janiszewski kurs historia technika Polak w technika xixw b ujdzie polecac latwo o gosc byc w sam siebie straszny ciezko sie z on dogadac zaliczenie obecnosc obowiazkowy nie uznawac zwolnienie lekarski i tym podobne za kazdy nieobecnosc h praca na statek h do przepracowania na statek jakis nieobecnosci dobrze odrobic szybko bo potem byc musac jechac do inny miasto odrabiac p zrobic swoj i byc miec spokoj oczywiscie moc pisac jakis referat ale ja by metr to nie robic bo to tzreba czytac przy inny profesoer d co nie byc ciekawy d dobrze zrobic ten h dziewczyna nie pracowac fizycznie skanowac jakis zdjecie d;3
269;wyklad ciekawy profesor okolo fajnie mowic traktowac student jak czlowiek a nie jak masa czesto zbaczac z temat opowiadac dowcipy gadac z my na kolokwia dac sie sciagac chociaz chodzic po sala i zagadywac czas nawet zabierac kartka zeby siebie ot tak poczytac ale ogolnie sympatyczny czlowiek moc dlatego ze wyklad byc mi a;2
270;Gierczak j profesor arch kurs cywilizacyjny aspekt motoryzacja super b na pierwszy zajecia przedstawiac zasada jezli losowo wybrac osoba z grupa okolo zaliczac kolokwium to nieobecnosc nieobecnosc i tak dalej wyklad prowadzic byc w niewielki sala wiec spac sie nie dac ale jak sie dobrze usiasc to mozny zrobic jakis zadanie albo poczytac gazeta wyklad w miara ciekawy choc zaden rewelacja;2
