;text;target
144;ogolnie nudno nie chodzic metr za duzo na wyklad ale tez nie wymagac to nie miec list obecnosc i taki tam glupot ten pani lubic miec cisza na wyklada wiec dobrze malo czlowiek ktory sluchac niz tlum gadajacy student na fizyka podobno przepisywac z cwiczenie na fizyka nie miec przepisywac ocena wyklad byc na necie to byc wygodny choc na egzamin warto uczyc sie z skrypt pytanie nie byc latwy ale na poprawka dawac ten sam co na termin tylko mieszac grupa ty termin zrobic z duzy problem ogolnie do przejsc;3
145;swietny czlowiek naprawde bardzo przyjazny dla student jak w kazdy wf liczyc sie obecnosc ale nie miec problem zeby na koniec zalapac lubic zartowac widac ze praca sprawiac on przyjemnosc;2
146;kurs rowa rozniczkowy ocena chodzic ideal jak na politechnike przystac albo moc jak byc powinien wyklad nieobowiazkowy wystarczyc ze chodzic ten osoba bo od ktos trzeba spisac co byc na kolokwium kolokwium przewidywalny prowadzic podawac zdanie wystarczyc zrobic i miec sie w kieszen ewentualnie spisac od ktos bo to tez nie stanowic problem;2
147;poprzednik mowic o komputerowy wspomagac praca inzynierski a ja powiedziec o teoria uklad cyfrowy pan tez byc wyluzowac nie robic problem kolokwi byc moze udac sie na zaliczenie wystarczyc napisac pozytywnie jeden na pierwszy kolo polecac sie nauczyc i poswiecic troszke czas na to oceniac pozytywnie;2
148;ocena polecac humor zabawny nie zaliczyc u on totrzeba sie o to postarac ogolnie polecac nie znacac sie nad student jak ktos nie zdarzyc oddac przed czas tz zostalo minuta do onca zdanie protokole to m bez sprawdzac i miec napewno z raz zapyc prz zdanie protokol pytac sie co i jak sie wzielo z co to wynikac i tak dalej odajemy protokoly na koniec zajec sprawka do dom wielki za to;2
149;podstawa inzynierria materialowy elektryczny bardzo nudny zero obecnosc ewko lo brak slaby ale zdarzac sie objaw poczucie humor wink neutralny moc byc ale tylko z wzglad na spsob zaliczenie zaczac trzeba od to ze profesor mazurek za cel prawdopodobnie postawic siebie zanudzic student pan pierwszy zajecie jeszcze dac sie zniesc co nieco byc jasny potem nie wyniosl em z zajecia kompletnie nic roll profesor wypisywac przez caly wyklad jakis wzor i konczyc w styl twierdzenie maxwella;3
150;miec em przyjemnosc miec z ten pani wyklad powiedziec krotko wiedza miec duzy ale nie potrafic on przekazac czesto mylic sie przy tablica robic zadanie na zaliczec dwa kolo u ja pierwszy zaliczyc okolo soba na caly grupe czyli ponad drugi jeszcze malo zaliczyc kolokwium poprawkowy zaliczyc osoba wiec pani isc my na reke zrobic jeszcze jeden poprawkowy ale juz nie dla wszyscy tylko dla ten ktory wedlug on pokazac na poprawka ze cos tam umiec ja zdac em na pierwszy poprawkowy i miec em spokoj w suma mily dla student chyba ze sie zdenerwywac ostatecznie nie polecac po co sie meczyc jak u inny mozna zdac bez problem ps z to co my powiedziec to po ten rok isc na emeryture;3
151;kurs fizykac laboratoria ocena unikac b pani doktor nalezec do fanatyczka fizyka juz na sam poczatek zaczac my wmawiac ze fizykac to nasz hobby uwazac ze fizyka byc wazny przedmiot i powinien smy on dobrze rozumiec niby prawda p raz lub dwa w semestr robic wejsciowka ktory z regula byc bardzo trudny do zaliczec takze trzeba pozno latac na konsultacja i sie meczyc na sam laboratori pytac zawsze i to bardzo szczegolowo potrafic wywalicza drobny pierdola nie uczc sie tylko z instrukcja kazdy pojecie ktory z instrukcja nie rozumiet musiec znalesc w necie i solidnie sie nauczyc pytac o kazdy zjawisko ktory miec cokolowiek wspolny z dany cwiczenie nie byc lekko rowniez z sprawozdania choc tu nie zwracac az tak czesto dlategotez nie polecac jak miec wybor to gdziekolwiek indziej;3
152;opinie na podstawa kursuatematyczny i cw na wydzial is sposob prowadzic zajecia absurdalny czy potrafic nauczyc nieeeeeeee podstawa ocena w indeks zaliczec kolokwiac niespodziewajka brak poczucie humor sie ze miec ogolny podejscie do student ciezko ocenic skomplikowan osobowosc ocena ogolny pan Marek to prawdziwy model na zajecia robic przepisowac zadanie ktory nijak miec sie do ten z kolokwiow ciezko dowiedziec sie o wynik kolokwiow czas trzeba dzwonic do dom ogolny chaos i balagan w jeden reka pisak w drugi gabka wiekszosc czas poswiecac na glupa gadanie godny polecenie jedynie osoba ktory byc wstanin nauczyc sie wszystko sam i lubic sie posmiac w przeciwny raz odradzac jakikolwiek kontakt mozna sam zeswirowac;1
153;nudny mozna nie chodzic nie sprawdzac obecnosc teoretycznie na koniec kolo mozna robic jednak badac w internet zdolnosc patentowy wybrac przedmiot zajmowac to od do godzina im wczesnie sie oddac tym dobrze;3
154;na algebra faktycznie byc spoko ale na przyklad na analiza na osoba tylko przejsc daleko byc my wy brakowac;3
155;  evil jakby byc napisal co o to czlowiek mysle to by ja prokurator na glowy wlazl;1
156;filozofia natura elektryczny bardzo ciekawy tak referat nie dotyczyc bardzo dowcipny czlowiek ok dobry profesor prowadzic zajecia baardzo rekreacyjc temat byc ciekawy kawala sypac z rekawa zawsz upoliwac siebie jeden dziewczyna caly czas byc on meczyc i on imie byc wystepowac w wszystek histoyjk lol na tamat wybitnie naukowy mowic w sposob bardzo prosty i przystepny na zaliczen wystarczyc przyniesc praca na a;2
157;kto doktor pan mlynarz kurs chemia organiczny i laborki ocena polecac b pan doktor byc mily i wyrozumiac dla student nie robic zaden wejsciowka na laborka starac sie pomoc przy identyfikacja zwiazek jak i przy doswiadczenie ocena byc dobry nawet bardzo dobry polecac;2
158;zaliczac bez problem obecnosc nie byc obowiazkowy na wyklad ale pan doktor mowic badzo ciekawy rzecz wiedz polec chodzic jesli chciec sie miec wiecej niz to trzeba napisac jakas praca to znaczy sciagnac cos z net i wydrukowac no i wtedy miec sie;2
159;zalezec z jaki grupa miec do czynic u my fizykac wppt wejsciowka byc czesto i dosc szczegolowy mozna powiedziec ze traktowac my z specjalny troska wink rowniez jesli chodzic o sprawozdanie nigdy nie trzeba byc oddawac w termin mozna byc on sie zwalic z kilka sprawka przed sam sesja a nawet w trakt oceniac dosc skrupulatnie bardzo dobrze znac sie na rzecz;3
160;doktor metr zielinsko blajetc kurs chemia organiczny ii cwiczenie b bardzo przyjaznie nastawiona do student bardzo dobrze tlumaczyc zadanek kolokwi ukladac prowadzic wyklad wiec na ten temat nie mo co sie wypowiadac ogolnie polecac swietny kobieta moc zarazic milosc do chemia organiczny wink;2
161;dotyczyc wyklad z elementow biotechnologia na technologia chemiczny wyklada ciekawy jednak trudno robic dobry notatka poniewaz pan doktor strasznie leciec;3
162;miec em juz semestr kosz za kazdy raz z ktos inny u gryszko byc tak sam sie rozgrzewac rzut i tym podobne a potem podzial na druzyna i grac do punkt i zmiana jak byc mniej czlowiek to dlugi mecz wedlug ja ten minuta to trochy za malo czas zdazac sie ze podzielic na druzyna i grac smy streetballa na kosze zwycieski moc raz opuscic zajecia bez konsekwencja zeby dostac bdb mozna byc miec nieobecnosc nieodrobiic nie mowic to dopiero przy wystawiac ocena atmosfera bardzo dobry prowadzic nie wychodzic nigdzie w czas zajecia tylko caly czas sedziowac powiedziec nawet jaki skutecznosc rzut wolny miec druzyna od czas do czas opieprza ktos za egoistyczny gra i bardzo dobrze naprawde mozna siebie pograc ale pod warunek ze grac sie dluzy niz do punkt;2
163;ocena unikac zaliczen brak ja nie zaliczyl robil kurs powtorowy prowadzic niezrozumiale nic nie naciagac punktow nie wart sie klucic bo jeszcze obniza ocene ogolc lipa ja by metr od on uciekalc jak najdalej;1
164;zdecydowanie polecem choc to totalny tajfun na tablica i co chwila trzeba on poprawiac to facet byc spoko jak czegos nie rozumiec to ty wytlumac jak do on podejdziec co najwazniejsze co chwila skracac naprawde warto;2
165;ocena do przejsc pan Jerzy to calkiem fajny matematyk co prawda dosyc ekscentryczny ale nie byc taki zly jak by sie moc wydawac ja miec em z on analiza i byc dosyc ciekawie kolokwia robic ambitny wiec warto sie uczyc miec nietypowy podejscie do matematyka zadanie wymyslac sam a nie korzystac z skrypt lubic aktywny na cwiczenia i za to zbierac sie u on sporo punkt na kolo tez warto walczyc do koniec bo to moc zaprocentowac u on liczyc sie sposob myslenie i podejscie do zadanie stawiac punkt za tok myslenie nawet jesli zadanie nie byc do koniec rozwiazac lub byc zle rozwiazac ogolnie pozytywnie byc ale dosyc ciezko nie polecac to ktory liczyc na latwy zaliczenie;3
166;po pierwszy mgr merdas doktor jeszcze nie zrobil i kto wiedziec czy zrobic spoko zie zaliczyc u on non problemo tylko tzrba przerobic zadanek z list ktore dawac podobny dawac na kolo takze zadanie robic na wykladzie zdarzaja sie na kolo pozdro polecac;2
167;wyklad i cwiczenie byc prowadzic b dobrze o ile nie musiec gonic z material wtedy byc to robic poprost zaszybko z zaliczeen nie miec duzy problem;2
168;przyrzad pp laborka polecac ten pan byc w porzadek wejsciowka nie byc trudny trzeba sie pouczyc z marciniak i instrukcja jak nie zaliczyc nie wywalac z zajecy mozna poprawic kartkowka na konsultacja potem tlumaczone byc dane cwiczenie wszystko jasno oceniac byc to co zostac zrobic a nie to co miec byc zrobic czesto nie starczac czas by wykonac caly cwiczenie pomagac w raz co bardzo sprawiedliwy;2
169;spac mozny jak na wiekszosci humanow pelen luz z zaliczeen zadc problemow a chodzic nie warto bo i tak sie z to nic nie wyniesc tylko czas sie tracic uwierzcie ja byl raz na i ostatni przy wpies i powiedzial jeszcze zdanie i miec;3
170;historia filozofia czlowiek i religia ocena dac sie przezyc b jesli chciec podyskutowac z pan ratajczakie nie miec sprawa byc otwarty na wszelki glos z sala Jesli sa zgodny z on poglad jesli miec inny zdanie po ten rozmowa bedziesz miec on mozna zupelnie nic nie robic byle nie miec za duzo nieobecnosc i zaliczyc ocene podwyzszac za referat lub wystapiec w przypadek seminarka jezec kogos nie intersowac human to mozna nawet spac byle nie chrapac wazny dla pan doktor byc teoria tzn nie trzeba sie on uczyc tylko zrozumiec pewien sprawa i pamietajcie wazny byc prawda prawda i jeszcze raz prawda d ogolnie polecac;2
171;analiza matematyczny i wyklad i cwiczenie elektryczny ciekawy calkiem zrozumiac tak wszystko tlumaczyc;2
172;kurs francuski b i b e bdb b bardzo sympatyczny pan lubic pozartowac na lekcja ale trzymac sie plan lekcja nie byc ten zart za duzo lekcja prowadzic mowic po francuski dbac o to by kazdy sie na zajecia odezwac ale jesli ktos cos nie potrafic nie gnebic pomagac nie miec zaden stres mily stosunek do student zaden problem jesli dobrze siebie radzic nie zwracac uwaga na nieobecnosc wazny by byc wszystko pozaliczac kolokwi niezbyt trudny material z zajecia nie miec u on kartkowko w ogol polecac;2
173;pani joanny byc okolo mial z nia cilowetr z analiza i na tez chetc by metr do on pojsc jak miec u pani bihun cw to praktycznie wyklad nie byc potrzebny gdyz wszystko tlumaczyc wink goraco polecac wink;2
174;ocena plecac pomimo zabawny chod i wyglad polecac w przeciwienstwo do pank problem sa przedstawic o wielel dobrze czesto sie mylic przy sprawdzac wiec warto wybrac sie na konsultacja dpoo kolo i czas dac sie o cos wyklucic w oj przypadek punkt uratowalyc ja tylek i zaliczyl trzeba sie to pouczyc;2
175;polecac wyluzowac koles nie robic duzy problem no ale to banalny przedmiot pan na zalicznie byc prosty kolowium z formatowac tekst w wordz i stworzyc nieskoplikowany baza dane no i ten pierwszy zajecia czyli zapoznac sie z pracownia i przepis bhp istny polewka;2
176;analiza wyklad metoda matematyczny fizyka wyklad i cwiczenie b na wyklad nie trzeba chodzic byc bardzo nudny przepisywanie skrypt nie miec sens tracic na on czas material bez problem mozna przerobic sam dla malo systematyczny student moc sprawic drobny trudnosc ale to dlatego ze sam kurs byc trudny i material byc dosc obszerny w semestr dwa kolo z zadanka taki jak w skrypt banal jesli sie cos wczesnie sam przeliczyc bez duzy problem mozna kozystac z sciag na egzamin byc podobnie byc jeszcze latwiejsz powtorke anal i w wydanie zespoloc wyklad olac chodzic na cwiczenie sledzic to co sie dziac na tablica przed kolo przejzec skrypt kolo byc standardowy i miec sie zaliczec piatka jak bardzo osiagalny bez wielki wysilek jedyny wady pan doktor K byc to ze otaczac on niezbyt przyjemny zapach ale byc przyjazny dla student polecac;3
177;pani doktor byc sluzbistka i nie dac sie z on zbytnio dogadac on wiedziec swoj i tyle nie miec ugoda na zjecie trzeba sie przygotowywac i potem pytac caly zajecie pod tablica dawac niewielki wprowadzic do kolejny zajec a raczej przepisowac zadanie z kartka przy on niewiele mozny sie nauczyc wedlug pani doktor konsultacja cyt;1
178;z zaliczeen kurs nie byc najmniejszy problem wszyscy sie udac pytanie latwiutki naprawde sam podstawa wyklad prowadzic niestety nieco chaotycznac pol godzina doktor spedzac na przypominanie co byc tydzien temu czas sie zakreci jesli ktos oczekiwac nowosc sroga sie zawiesc doktor szczygiel opowiadac z sentyment o odra twierdzic z mysz podlaczac sie pod port com i nie reagowac na uwaga student ze taki mysz juz prawie nie miec i wyklad byc w wiekszosc poswiecic starocia;3
179;docent kolodzo bardzo sympatyczny obecnosc na zajeci nie byc obowiazkowy na koniec jesli brakowac ty jeden punkt to bez problem nat a;3
180;wyluzowac koles wyklad nudnawy mowic czesto za cicho czas zaczynac pisac na tablica taki rzecz ze mozna odleciec ale zaliczenie w miara latwy ale trzeba miec szczescie nie siedziec z przod p ten pan az pros i;3
181;spac sie dac i warunki byc sprzyjac duszno i ciasno obecnosc sprawdzac slownie wiec trzeba byc obecny cialo i duch nie dac sie nikt wpisac na lista fajny stary pan wrazliwy i miec duzy wiedza zyciowy do przekazac mlody pokolec;3
182;zaliczec kurs na podstawa notatka z wyklad badz praca do napisac nie sprawdzac obecnosc a prowadzic ciekawie w ciag h powiedziec minuta na temat a resztec opowiadac rozny historia z temat nie zwiazac;3
183;mial z ten pan cwiczenie i byc calk zadowolony zadanie na kolo z skrypt albo z ksiazeczka kolo K;2
184;zajecie prowadzic w zawrotny tempo przez jeden semestr przerabiac caly ksiazke na poziom b zaliczec ten kartkowka i test z egzamin b nie miec wiekszy problemow z dobro ocena mily sympatyczny kobieta lubic student;3
185;w wemif wyklad fenomenalny cwiczenie ciekawy ale dosc trudny potrafic i to jeszcze jak kolokwiac jesli oblejec to egzamin zdarzylac sie jeden niezbyt przyjemny teoria specyficzny swietny swietny ale niezbyt luzny zajebista na wyklad na cwiczenie dobry ale wymagajacy algebry z on byl najfajniejszy kurs na pierwszy semestr tlumaczy material tak z kazda zrozumiec jasno klarownie i gruntownie bez pospiech na cwiczenio robic tylko ciekawy zadanie kola SA sredni trudnosci ale warto sie na on uczyc ja poszedl na egzamin i musz powiedziec z byl trudny nie miec szansa zeby zaliczyc egzamin na wyzy niz na poczatek gosc starac sie wystraszyc ale byc bardzo fajny czlowiek jak pogadalismy z on raz na cwiczenio na prywatn i na luz to okazal sie zajebisty rozmowca dziewczyna muszac sie uzbroic w cierpliwosc i tolerancja mog miec pewno z doktor dudek sie on zaopiekywac dowcip miec ostry ale nie chamski;3
186;miec em przyjemnosc z ten doktor miec zajec algebro i i algebry liniowa ii nie byc on przyjazny student on atut byc to z dobrze wykladac choc mial u on z algebry i algebry ii to do dzisiaj pamietac w jaki sposob rozwiazywac wazniejsze zadanie z ten przedmiot prawde mowiac dobrze pomeczyc sie na rokku nizec poznie panikowac tyle komplement a zeczywistosc bywac szokujacy kolokwia sa stanowczo zatrudny poniewaz tresc zadanie wykraczac swoj trudnoscie poza skrypt ale na egzamin natomiast byc latwo poniewaz nikt ukladac zadanie nie dawac podobny do ten napisac przez michalik ogolny ocena dac sie przezyc ale nie polecac;3
187;kurs informacja patentowy ocena w porzadek b pan kotarba to bardzo przyjazny i idacy na reke wykladowiec na zaliczenie byc kolokwium albo praca polegajaca na ocena zdolnosc patentowy wybrac wynalazek zajmowac to par godzina i z glowa sam wyklad nudny a przyjemny glos profesor popoludniowy godzina sprawiac z wiele wyklad przespac em obecnosc nie byc sprawdzac ogolnie polecac szczegolnie ze to human za punkt;2
188;wyjatkowo mily czlowiek nieco zestresowac obecnosc swiat i czlowiek ale jakos siebie radzic patrzec w podloga podobno pomagac kolokwi byc tak prosty z bardzo sie nie dac zadanie z skrypt przed kolokwium mowic jeszcze ktory ale jezeli nie miec sie samozaparcie ciezko sie cos porzadnie nauczyc jesli miec mozliwosc a semestr zapowiadac sie na tyle ciezko ze warto wrzucic na luz zapic sie do kapelka;3
189;ocena moze byc zaliczec kola egzamin nie potrafic poradzc siebie z student ciagle on ktos przeszkadzac na sala szum i rozmowa byc trochy nie slowny jak m z czegos nie bedzie to i tak bedzie przygotowywac kola jak on sie podobac na drugi kolo trafilo ja sie zadanie z poczatek wykladow co obowiazywalo na kolo ogolnia nie byc zla zadan nie dawac jakis wyszukany i trudny trzeba sie troche przygotowac ale luzik jak dla ja zaliczyl w egzamin;3
190;mysle ze byc to dobry wybor na rr prowadzic wszystko skrupulatnie wytlumaczyc jak sam mowic;2
191;algebry wyklad bardzo fajny kobieta robic sporo przykladowy zadanie warto wiec sie pojawiac na wyklad szczegolnie jesli to pierwszy kontakt z algebra wszystko byc jasno wytlumaczic jesli nie to spokojnie mozna zadawac pytanie polecac;2
192;doktor krzeminski to fizyk i matematyk w jeden bardzo przyjemnie chodzic sie do ten pan na cwiczenie nie wiedziec jak na wyklad nie chodzic em kolokwiac na poziom skrypt nie problem sie nauczyc myslec ze mozna bez zaden obawa brac kurs z doktor krzeminski;2
193;doktor adac swida kurs ekonomia przedsiebiorstwo polecac b zaliczec za obecnosc d nic nie tzreba robic mozna czytac gazete lub ksiazke d goscie miec z rok taki spox d czytac listy wiec nie wpiszesz sie na zalegly obecnosc u my raz puscic listy ale potem stwierdzic z daleko byc czytac bo tak szybko niedziwi sie czlowiek siebie wpisywac obecnosc wczesnie a nawet na zapas d hehe miec em nieobecnosc na chyba i dac ja mozna sie z on dogadac lu zwolnic on przyniesc d uznawac d;2
194;wozniak Wladyslaw Artur dr inz fizykac cw moc byc b na cwiczenia nagr a;2
195;przyrzada polprzewodnikowy i polecac dla wemif u to chyba pierwszy kontakt z perspektywa wykladow na i semestr z czlowiek ktora opowiadac o naprawde interesujacy strona elektronik gadac duzo i na temat chociaz czas potrafic znuzyc zbyt obszerny rozwazani na temat;3
196;co do ekranowka to musiec stwierdzic ze byc to jeden z najbanalniejszy forma zaliczac kurs pytanie mozna znalezc na siec co rok byc ten sam a wiec niezaleznie od poziom on trudnosc z zaliczeen problem nie miec zaden wystarczyc siasc dzien wczesnie znalezc wydrukowac wziasc z siebie i sciagnac w wersja bardzo pro wkuc on na pamiec i tyle nie wiedziec z co mozna miec tu problem;3
197;kolodzi b docent podstawa chemia ogolny laborka ocena zloto kobieta d b w semestr robic dwa kartkowka tak banalny ze jak ktos przygotowac sie przez minuta do on to nie miec problem by zaliczyc on na conajmni na zajecia wykonywac sie prosty cwiczenie ktory nie sprawiac trudnosc jesli tylko uwaznie przeczytac sie instrukcja ponadto trzeba pisac krotki opis to co sie robic na zajecia w zeszycie oraz trzeba wyciagnac odpowiedni wniosek mniej kumat moc bez problem spisac on od ktos inny polecac on wszyscy nie chemikom pan;2
198;w ciagu semestr pytac z przygotowanie do laborka raz zazwyczaj zapominalac o to wystrczylac ja dobrze zagadac sprawozdanie kazalac poprawic do bul a jesli chodzic o termin on oddawac to prawie do konca sesja zaliczenie biezy trochy dziwny srednie ocena z sprawozdanie zalezy to od on humor;3
199;matematyka to on cie nie nauczyc ale jesli umiec sie sam z skrypt nauczyc to zapic sie do on SA kolokwiac na kolokwi sam wymysla zadanie ktore raz SA latwy a raz nie teoretycznie zeby zaliczyc trzeba miec punkt z dwoch kolokwiow ale kumpel mial i poszedl do on nasciemnial on z musiec gdzies wyjechac a on on dopytal no i oczywisc zaliczyl jesli brakowac ty dwoch punktow do zliczenie to i tak zaliczyc nawet bez dopytka a no i jeszcze jeden pan doktor czas sie zaieszac tak na okolo minuta sam wymysli siebie zadanie a potem rozwiazywac on przez caly zajecie ale ogolnie polecac ten pan;3
200;fizykac h cwiczenie dl a porownaj;3
201;kurs chemia ogolna ii laboratorium ocena suppperr b doktor byc super poprost pomagac i wszystko ladnie wytlumaczyc miec em labork w suma z doktor duczmal ale on prowadzic drugi grupa na ten sam sala to zawsze do on chodzic em po pomoc fajny i przyjemny pan;2
202;pan mgr biezunski byc extra za chodzec pod warunek ze nie miec spoznien ani nieobecnosc duzo cwiczenie mozna cos sie nauczyc no i duzo pograc czesto byc konkurs na punkt zwlaszcza dwutakt i test sprawnosciowy druzyna na ogol od steetball do kosz na caly boisko;2
203;jako przedstwailcielka plec piekny moge powiedziec ze prowadzak ogolnie byc okolo fakt duzo pytac mecz zwlaszcza dziewczyna ale potem to plusowac na kolo wystarczyc uczyc sie jeden nocke i byc okolo;3
204;niemiecki a e polecac nawet bardzo pani mgr robic sporo zeby student zdac egzamin stary sie robic wszystko to co trzeba i nie zameczac czlowiek zbednymi pier d;2
205;miernictwo elektroniczny laboratorium ocena ujsc od bieda b to byc dziwny pan ktory sam zabardzo nie wiedziec co chciec laborka rozpoczynac sie od wejsciowka z cwiczenie obecny i cwiczenie ktory miec smy na poprzedni laborka ale byc w miary latwy do nauczec z instrukcja jak ktos byc obeznac z elektronika to poradzic siebie u on bez problem;3
206;informatyka w wemif ciekawy na luz potrafic ale trzeba byc na bierzaco i rozumiec o co chodzic dosc trudny kolokwi raczej nie humor informatyczny jak dla ja swietny fenomenalny goraco polecac swietny prowadzak nie zapomnial jak to byc student kolokwiac dosc trudny ale spokojnie do przejscie prawdziwy pasjonat temat oby wiecej taki na pwr ja tez przy okazja pozdrawiac;2
207;wyk cw zarowno wyklad jak i cwiczenie prowadzic bardzo starannie i precyzyjc jesli chciec sie nauczyc wybierz doktor gorniak niestety z zaliczeen nie byc latwo kolokwiac oceniac w system ale generalnie jesli byc na biezaco zdac ja bezstresowo miec em w kolokwi z obydwu przedmiot na egzamin nie byc em ale slyszec em ze byc ciezko;3
208;pani barbara na pewno dobrze wyloza sprawa dobrze opowiedziec i kazdy wiedziec co do osobowosc to nie dawac rada miec bardzo rozny i dziwny nastroj jak kobieta nie mozna do on mowic pani doktor bo to on obrazac to byc pani docent i nie mozna powiedziec inaczej na zajecia nie mozna popatrzec na okno trzeba zawsze powiedziec tak oczywiscie rozumiec nie mozna sie smiac ani nic z ten rzecz pani doc lubic troszke wazelina ahao powiedziec em ten pani byc automatyk ale na wydzial elektronik wiec pisze o on w ten dzial;3
209;pani starszy data wiec nie spodziewajc sie fajerwerk na wyklady przepisowac skrypt na tablica wymagac absolutny cisza miec sluch i wzrok absolutny uslyszec i wypatrz wszystko na dodatek pamietac kto gdzie na ktory wykladzac siedziec i kiedy on nie byc lubic jak sie przychodzic do on na konsultacja z zadanka i ogolnie jak ktos kojarzyc z twarz i nazwisko to byc dla ten osoba lagodniejsz kolokwi raczej prosty zadanka elemantarny wystarczyc znac wzor na dodatek zadanie praktycznie z skrypt tylko zmieniac liczba kochac ten ksiazeczka;3
210;wstep do programowania wyklad raczej odradzac b juz po pierwszy wyklada nabrac em przekonanie a po drugi byc em juz pewny ze nie byc na on chodzic byc po prosty nudny potem byc kolkwium trudny test wybor ostry pilnowanie niewiel zaliczyc poprawka oceniac duzo lagodnie ostatecznie kazdy kto choc troszke sie pouczyc zaliczyc;3
211;wyklad prowadzic nawet ciekawie ocena byc za obecnosc ale trzeba uwazac bardzo nie lubic gadajacy i zdarzac on sie postawic przy nazwisko kropka jak sie pojawic kolejny to miec nieobecnosc ale nie przeszkadzac on jak nie uwazac ale musiec siedziec cicho i zajmowac sie na przyklad gazet i tym podobne polecac;2
212;zgadzac sie w zupelnosc z powyzszy opinia warto chodzic na wykalad bo byc niepowatrzalny;2
213;wyklad byc niezrozumialy pokazywac wszystko byc na slajde z wyklad nic nie zrozumiec trzeba sam sie uc zyc ale doktor panek miec bardzo fajny humor i dac sie z on pozartowac i dogadac kola SA w miary prosty uczyc sie i zdac nie byc wymagajacy czlowiek jeden kolokwium na koncu semstr ale czsami dac sie z on rozmawiac;3
214;uciekajt od on jesli tyklo mozec mial z on pakiety uzytkowy koszmar tyle raz co sie na wqrwial to masakry zawsze wychodzilem znerwiyc zadaz zadamoe i nic wiecej nie powiedzial zadc konkretow o co chodzic w on i zamiast godzina bez przerwa to mielismy godzina bez przewry i to normalny godzina a nie po minuta polecac on omijac szeroki luk rok budownictwo mial teraz z on niezla jazde chcial dac kolo wpisow do indeksow w godzina nie wyszloyc oczywisc ponad indeksow nie oddal dodac z odbywalo sie to w sobote od a skonczylo o czyli malo ciekawie zdenerwowal trochy czlowiek oj zdenerwowal jakies to co czekalo ten dostal w miary szybko indeksy po jakis godzinka wykrelsc ten nazwisko z planow;1
